{
  "title": "潮汐的形成与变化",
  "core_message": "潮汐是受月球和太阳引力等影响、由地球自转等带来规律升降的海水整体运动，通常一天两次涨落，大潮小潮和海岸地形会改变具体表现。",
  "necessary_points": [
    {
      "point": "潮汐是海面有规律的升降。",
      "source_quotes": [
        "潮汐是海面有规律的升降。"
      ]
    },
    {
      "point": "月球引力与地球和月球围绕共同质心运动的惯性作用，使地球两侧海水都倾向形成隆起。",
      "source_quotes": [
        "地球上的海水受到月球引力作用，同时地球和月球围绕共同质心运动产生的惯性作用，使地球两侧的海水都倾向形成隆起。"
      ]
    },
    {
      "point": "地球自转使海岸依次经过不同海面高度，通常一天两次涨潮和两次落潮，但具体次数和时间随地点不同。",
      "source_quotes": [
        "地球自转使许多海岸地区依次经过不同的海面高度，因此通常一天会出现两次涨潮和两次落潮，但具体次数和时间会随地点而不同。"
      ]
    },
    {
      "point": "太阳引力也影响潮汐；地球、月球、太阳排成一线时潮差通常较大，称为大潮，成直角时两者作用部分抵消，潮差通常较小，称为小潮。",
      "source_quotes": [
        "太阳的引力也会影响潮汐。",
        "当地球、月球、太阳大致排成一线时，太阳和月球的潮汐作用方向接近，潮差通常较大，称为大潮；当月球与太阳相对地球大致成直角时，两者作用部分抵消，潮差通常较小，称为小潮。"
      ]
    },
    {
      "point": "海岸形状、水深和海底地形会改变潮汐传播，不同海湾的潮汐时间与高度并不完全相同；潮汐是海水整体运动，不等于每处海面都以同样方式升降。",
      "source_quotes": [
        "海岸的形状、水深和海底地形会进一步改变潮汐传播，因此不同海湾的潮汐时间与高度并不完全相同。",
        "潮汐是海水整体运动，不等于每一处海面都以同样方式升降。"
      ]
    }
  ],
  "omissions": [
    "未展开共同质心运动和惯性作用的具体物理推导。",
    "未给出具体海湾的潮汐时间、潮差等数值。"
  ],
  "ambiguities": [
    "原文用“通常”描述一天两次涨落潮，未列出例外地点的具体条件。",
    "原文未给出大潮与小潮的潮差阈值或量化标准。"
  ],
  "segments": [
    {
      "id": "n1",
      "text": "潮汐是海面有规律的升降现象。",
      "source_quotes": [
        "潮汐是海面有规律的升降。"
      ]
    },
    {
      "id": "n2",
      "text": "地球上的海水受到月球引力作用，同时地球和月球围绕共同质心运动产生的惯性作用，使地球两侧的海水都倾向形成隆起。月球引力会影响潮汐。",
      "source_quotes": [
        "地球上的海水受到月球引力作用，同时地球和月球围绕共同质心运动产生的惯性作用，使地球两侧的海水都倾向形成隆起。"
      ]
    },
    {
      "id": "n3",
      "text": "地球自转使许多海岸地区依次经过不同的海面高度，因此通常一天会出现两次涨潮和两次落潮，但具体次数和时间会随地点而不同。",
      "source_quotes": [
        "地球自转使许多海岸地区依次经过不同的海面高度，因此通常一天会出现两次涨潮和两次落潮，但具体次数和时间会随地点而不同。"
      ]
    },
    {
      "id": "n4",
      "text": "太阳的引力也会影响潮汐。当地球、月球、太阳大致排成一线时，太阳和月球的潮汐作用方向接近，潮差通常较大，称为大潮。",
      "source_quotes": [
        "太阳的引力也会影响潮汐。",
        "当地球、月球、太阳大致排成一线时，太阳和月球的潮汐作用方向接近，潮差通常较大，称为大潮"
      ]
    },
    {
      "id": "n5",
      "text": "当月球与太阳相对地球大致成直角时，两者作用部分抵消，潮差通常较小，称为小潮。",
      "source_quotes": [
        "当月球与太阳相对地球大致成直角时，两者作用部分抵消，潮差通常较小，称为小潮。"
      ]
    },
    {
      "id": "n6",
      "text": "海岸的形状、水深和海底地形会进一步改变潮汐传播，因此不同海湾的潮汐时间与高度并不完全相同。潮汐是海水整体运动，不等于每一处海面都以同样方式升降。",
      "source_quotes": [
        "海岸的形状、水深和海底地形会进一步改变潮汐传播，因此不同海湾的潮汐时间与高度并不完全相同。",
        "潮汐是海水整体运动，不等于每一处海面都以同样方式升降。"
      ]
    }
  ]
}
